code,title,Level,Hierarchical_structure,parent,noc1d,noc2d,noc3d,noc4d
A,Management Occupations,1,Broad occupational category,NA,A,NA,NA,NA
A0,Senior Management Occupations,2,Major group,A,A,A0,NA,NA
A01,Legislators and Senior Management,3,Minor group,A0,A,A0,A01,NA
A011,Legislators,4,Unit group,A01,A,A0,A01,A011
A012,Senior Government Managers and Officials,4,Unit group,A01,A,A0,A01,A012
A013,"Senior Managers - Financial, Communications and Other Business Services",4,Unit group,A01,A,A0,A01,A013
A014,"Senior Managers - Health, Education, Social and Community Services and Membership Organizations",4,Unit group,A01,A,A0,A01,A014
A015,"Senior Managers - Trade, Broadcasting and Other Services, n.e.c.",4,Unit group,A01,A,A0,A01,A015
A016,"Senior Managers - Goods Production, Utilities, Transportation and Construction",4,Unit group,A01,A,A0,A01,A016
A1,Specialist Managers,2,Major group,A,A,A1,NA,NA
A11,Administrative Services Managers,3,Minor group,A1,A,A1,A11,NA
A111,Financial Managers,4,Unit group,A11,A,A1,A11,A111
A112,Human Resources Managers,4,Unit group,A11,A,A1,A11,A112
A113,Purchasing Managers,4,Unit group,A11,A,A1,A11,A113
A114,Other Administrative Services Managers,4,Unit group,A11,A,A1,A11,A114
A12,"Managers in Engineering, Architecture, Science and Information Systems",3,Minor group,A1,A,A1,A12,NA
A121,Engineering Managers,4,Unit group,A12,A,A1,A12,A121
A122,Computer and Information Systems Managers,4,Unit group,A12,A,A1,A12,A122
A123,Architecture and Science Managers,4,Unit group,A12,A,A1,A12,A123
A13,"Sales, Marketing and Advertising Managers",3,Minor group,A1,A,A1,A13,NA
A131,"Sales, Marketing and Advertising Managers",4,Unit group,A13,A,A1,A13,A131
A14,Facility Operation and Maintenance Managers,3,Minor group,A1,A,A1,A14,NA
A141,Facility Operation and Maintenance Managers,4,Unit group,A14,A,A1,A14,A141
A2,"Managers in Retail Trade, Food and Accommodation Services",2,Major group,A,A,A2,NA,NA
A21,Managers in Retail Trade,3,Minor group,A2,A,A2,A21,NA
A211,Retail Trade Managers,4,Unit group,A21,A,A2,A21,A211
A22,Managers in Food Service and Accommodation,3,Minor group,A2,A,A2,A22,NA
A221,Restaurant and Food Service Managers,4,Unit group,A22,A,A2,A22,A221
A222,Accommodation Service Managers,4,Unit group,A22,A,A2,A22,A222
A3,Other Managers n.e.c.,2,Major group,A,A,A3,NA,NA
A30,Managers in Financial and Business Services,3,Minor group,A3,A,A3,A30,NA
A301,"Insurance, Real Estate and Financial Brokerage Managers",4,Unit group,A30,A,A3,A30,A301
A302,"Banking, Credit and Other Investment Managers",4,Unit group,A30,A,A3,A30,A302
A303,Other Business Services Managers,4,Unit group,A30,A,A3,A30,A303
A31,Managers in Communication (Except Broadcasting),3,Minor group,A3,A,A3,A31,NA
A311,Telecommunication Carriers Managers,4,Unit group,A31,A,A3,A31,A311
A312,Postal and Courier Services Managers,4,Unit group,A31,A,A3,A31,A312
A32,"Managers in Health, Education, Social and Community Services",3,Minor group,A3,A,A3,A32,NA
A321,Managers in Health Care,4,Unit group,A32,A,A3,A32,A321
A322,Administrators - Post-Secondary Education and Vocational Training,4,Unit group,A32,A,A3,A32,A322
A323,School Principals and Administrators of Elementary and Secondary Education,4,Unit group,A32,A,A3,A32,A323
A324,"Managers in Social, Community and Correctional Services",4,Unit group,A32,A,A3,A32,A324
A33,Managers in Public Administration,3,Minor group,A3,A,A3,A33,NA
A331,Government Managers - Health and Social Policy Development and Program Administration,4,Unit group,A33,A,A3,A33,A331
A332,"Government Managers - Economic Analysis, Policy Development and Program Administration",4,Unit group,A33,A,A3,A33,A332
A333,Government Managers - Education Policy Development and Program Administration,4,Unit group,A33,A,A3,A33,A333
A334,Other Managers in Public Administration,4,Unit group,A33,A,A3,A33,A334
A34,"Managers in Art, Culture, Recreation and Sport",3,Minor group,A3,A,A3,A34,NA
A341,"Library, Archive, Museum and Art Gallery Managers",4,Unit group,A34,A,A3,A34,A341
A342,"Managers - Publishing, Motion Pictures, Broadcasting and Performing Arts",4,Unit group,A34,A,A3,A34,A342
A343,"Recreation, Sports and Fitness Program and Service Directors",4,Unit group,A34,A,A3,A34,A343
A35,Managers in Protective Service,3,Minor group,A3,A,A3,A35,NA
A351,Commissioned Police Officers,4,Unit group,A35,A,A3,A35,A351
A352,Fire Chiefs and Senior Firefighting Officers,4,Unit group,A35,A,A3,A35,A352
A353,"Commissioned Officers, Armed Forces",4,Unit group,A35,A,A3,A35,A353
A36,Managers in Other Services,3,Minor group,A3,A,A3,A36,NA
A361,Other Services Managers,4,Unit group,A36,A,A3,A36,A361
A37,Managers in Construction and Transportation,3,Minor group,A3,A,A3,A37,NA
A371,Construction Managers,4,Unit group,A37,A,A3,A37,A371
A372,Residential Home Builders and Renovators,4,Unit group,A37,A,A3,A37,A372
A373,Transportation Managers,4,Unit group,A37,A,A3,A37,A373
A38,Managers in Primary Production (Except Agriculture),3,Minor group,A3,A,A3,A38,NA
A381,Primary Production Managers (Except Agriculture),4,Unit group,A38,A,A3,A38,A381
A39,Managers in Manufacturing and Utilities,3,Minor group,A3,A,A3,A39,NA
A391,Manufacturing Managers,4,Unit group,A39,A,A3,A39,A391
A392,Utilities Managers,4,Unit group,A39,A,A3,A39,A392
B,"Business, Finance and Administrative Occupations",1,Broad occupational category,NA,B,NA,NA,NA
B0,Professional Occupations in Business and Finance,2,Major group,B,B,B0,NA,NA
B01,"Auditors, Accountants and Investment Professionals",3,Minor group,B0,B,B0,B01,NA
B011,Financial Auditors and Accountants,4,Unit group,B01,B,B0,B01,B011
B012,Financial and Investment Analysts,4,Unit group,B01,B,B0,B01,B012
B013,"Securities Agents, Investment Dealers and Brokers",4,Unit group,B01,B,B0,B01,B013
B014,Other Financial Officers,4,Unit group,B01,B,B0,B01,B014
B02,Human Resources and Business Service Professionals,3,Minor group,B0,B,B0,B02,NA
B021,Specialists in Human Resources,4,Unit group,B02,B,B0,B02,B021
B022,Professional Occupations in Business Services to Management,4,Unit group,B02,B,B0,B02,B022
B1,Finance and Insurance Administration Occupations,2,Major group,B,B,B1,NA,NA
B11,Finance and Insurance Administrative Occupations,3,Minor group,B1,B,B1,B11,NA
B111,Bookkeepers,4,Unit group,B11,B,B1,B11,B111
B112,Loan Officers,4,Unit group,B11,B,B1,B11,B112
B113,Insurance Adjusters and Claims Examiners,4,Unit group,B11,B,B1,B11,B113
B114,Insurance Underwriters,4,Unit group,B11,B,B1,B11,B114
B115,"Assessors, Valuators and Appraisers",4,Unit group,B11,B,B1,B11,B115
B116,"Customs, Ship and Other Brokers",4,Unit group,B11,B,B1,B11,B116
B2,Secretaries,2,Major group,B,B,B2,NA,NA
B21,"Secretaries, Recorders and Transcriptionists",3,Minor group,B2,B,B2,B21,NA
B211,Secretaries (Except Legal and Medical),4,Unit group,B21,B,B2,B21,B211
B212,Legal Secretaries,4,Unit group,B21,B,B2,B21,B212
B213,Medical Secretaries,4,Unit group,B21,B,B2,B21,B213
B214,Court Recorders and Medical Transcriptionists,4,Unit group,B21,B,B2,B21,B214
B3,Administrative and Regulatory Occupations,2,Major group,B,B,B3,NA,NA
B31,Administrative and Regulatory Occupations,3,Minor group,B3,B,B3,B31,NA
B311,Administrative Officers,4,Unit group,B31,B,B3,B31,B311
B312,Executive Assistants,4,Unit group,B31,B,B3,B31,B312
B313,Personnel and Recruitment Officers,4,Unit group,B31,B,B3,B31,B313
B314,Property Administrators,4,Unit group,B31,B,B3,B31,B314
B315,Purchasing Agents and Officers,4,Unit group,B31,B,B3,B31,B315
B316,Conference and Event Planners,4,Unit group,B31,B,B3,B31,B316
B317,Court Officers and Justices of the Peace,4,Unit group,B31,B,B3,B31,B317
B318,"Immigration, Employment Insurance and Revenue Officers",4,Unit group,B31,B,B3,B31,B318
B4,Clerical Supervisors,2,Major group,B,B,B4,NA,NA
B41,Clerical Supervisors,3,Minor group,B4,B,B4,B41,NA
B411,"Supervisors, General Office and Administrative Support Clerks",4,Unit group,B41,B,B4,B41,B411
B412,"Supervisors, Finance and Insurance Clerks",4,Unit group,B41,B,B4,B41,B412
B413,"Supervisors, Library, Correspondence and Related Information Clerks",4,Unit group,B41,B,B4,B41,B413
B414,"Supervisors, Mail and Message Distribution Occupations",4,Unit group,B41,B,B4,B41,B414
B415,"Supervisors, Recording, Distributing and Scheduling Occupations",4,Unit group,B41,B,B4,B41,B415
B5,Clerical Occupations,2,Major group,B,B,B5,NA,NA
B51,"Clerical Occupations, General Office Skills",3,Minor group,B5,B,B5,B51,NA
B511,General Office Clerks,4,Unit group,B51,B,B5,B51,B511
B513,Records Management and Filing Clerks,4,Unit group,B51,B,B5,B51,B513
B514,Receptionists and Switchboard Operators,4,Unit group,B51,B,B5,B51,B514
B52,Office Equipment Operators,3,Minor group,B5,B,B5,B52,NA
B522,Data Entry Clerks,4,Unit group,B52,B,B5,B52,B522
B523,Desktop Publishing Operators and Related Occupations,4,Unit group,B52,B,B5,B52,B523
B524,Telephone Operators,4,Unit group,B52,B,B5,B52,B524
B53,Finance and Insurance Clerks,3,Minor group,B5,B,B5,B53,NA
B531,Accounting and Related Clerks,4,Unit group,B53,B,B5,B53,B531
B532,Payroll Clerks,4,Unit group,B53,B,B5,B53,B532
B533,Customer Service Representatives - Financial Services,4,Unit group,B53,B,B5,B53,B533
B534,"Banking, Insurance and Other Financial Clerks",4,Unit group,B53,B,B5,B53,B534
B535,Collectors,4,Unit group,B53,B,B5,B53,B535
B54,Administrative Support Clerks,3,Minor group,B5,B,B5,B54,NA
B541,Administrative Clerks,4,Unit group,B54,B,B5,B54,B541
B542,Personnel Clerks,4,Unit group,B54,B,B5,B54,B542
B543,Court Clerks,4,Unit group,B54,B,B5,B54,B543
B55,"Library, Correspondence and Related Information Clerks",3,Minor group,B5,B,B5,B55,NA
B551,Library Clerks,4,Unit group,B55,B,B5,B55,B551
B552,"Correspondence, Publication and Related Clerks",4,Unit group,B55,B,B5,B55,B552
B553,"Customer Service, Information and Related Clerks",4,Unit group,B55,B,B5,B55,B553
B554,Survey Interviewers and Statistical Clerks,4,Unit group,B55,B,B5,B55,B554
B56,Mail and Message Distribution Occupations,3,Minor group,B5,B,B5,B56,NA
B561,"Mail, Postal and Related Clerks",4,Unit group,B56,B,B5,B56,B561
B562,Letter Carriers,4,Unit group,B56,B,B5,B56,B562
B563,"Couriers, Messengers and Door-to-Door Distributors",4,Unit group,B56,B,B5,B56,B563
B57,"Recording, Scheduling and Distributing Occupations",3,Minor group,B5,B,B5,B57,NA
B571,Shippers and Receivers,4,Unit group,B57,B,B5,B57,B571
B572,Storekeepers and Parts Clerks,4,Unit group,B57,B,B5,B57,B572
B573,Production Clerks,4,Unit group,B57,B,B5,B57,B573
B574,Purchasing and Inventory Clerks,4,Unit group,B57,B,B5,B57,B574
B575,Dispatchers and Radio Operators,4,Unit group,B57,B,B5,B57,B575
B576,Transportation Route and Crew Schedulers,4,Unit group,B57,B,B5,B57,B576
C,Natural and Applied Sciences and Related Occupations,1,Broad occupational category,NA,C,NA,NA,NA
C0,Professional Occupations in Natural and Applied Sciences,2,Major group,C,C,C0,NA,NA
C01,Physical Science Professionals,3,Minor group,C0,C,C0,C01,NA
C011,Physicists and Astronomers,4,Unit group,C01,C,C0,C01,C011
C012,Chemists,4,Unit group,C01,C,C0,C01,C012
C013,"Geologists, Geochemists and Geophysicists",4,Unit group,C01,C,C0,C01,C013
C014,Meteorologists,4,Unit group,C01,C,C0,C01,C014
C015,Other Professional Occupations in Physical Sciences,4,Unit group,C01,C,C0,C01,C015
C02,Life Science Professionals,3,Minor group,C0,C,C0,C02,NA
C021,Biologists and Related Scientists,4,Unit group,C02,C,C0,C02,C021
C022,Forestry Professionals,4,Unit group,C02,C,C0,C02,C022
C023,"Agricultural Representatives, Consultants and Specialists",4,Unit group,C02,C,C0,C02,C023
C03,"Civil, Mechanical, Electrical and Chemical Engineers",3,Minor group,C0,C,C0,C03,NA
C031,Civil Engineers,4,Unit group,C03,C,C0,C03,C031
C032,Mechanical Engineers,4,Unit group,C03,C,C0,C03,C032
C033,Electrical and Electronics Engineers,4,Unit group,C03,C,C0,C03,C033
C034,Chemical Engineers,4,Unit group,C03,C,C0,C03,C034
C04,Other Engineers,3,Minor group,C0,C,C0,C04,NA
C041,Industrial and Manufacturing Engineers,4,Unit group,C04,C,C0,C04,C041
C042,Metallurgical and Materials Engineers,4,Unit group,C04,C,C0,C04,C042
C043,Mining Engineers,4,Unit group,C04,C,C0,C04,C043
C044,Geological Engineers,4,Unit group,C04,C,C0,C04,C044
C045,Petroleum Engineers,4,Unit group,C04,C,C0,C04,C045
C046,Aerospace Engineers,4,Unit group,C04,C,C0,C04,C046
C047,Computer Engineers (Except Software Engineers and Designers),4,Unit group,C04,C,C0,C04,C047
C048,"Other Professional Engineers, n.e.c.",4,Unit group,C04,C,C0,C04,C048
C05,"Architects, Urban Planners and Land Surveyors",3,Minor group,C0,C,C0,C05,NA
C051,Architects,4,Unit group,C05,C,C0,C05,C051
C052,Landscape Architects,4,Unit group,C05,C,C0,C05,C052
C053,Urban and Land Use Planners,4,Unit group,C05,C,C0,C05,C053
C054,Land Surveyors,4,Unit group,C05,C,C0,C05,C054
C06,"Mathematicians, Statisticians and Actuaries",3,Minor group,C0,C,C0,C06,NA
C061,"Mathematicians, Statisticians and Actuaries",4,Unit group,C06,C,C0,C06,C061
C07,Computer and Information Systems Professionals,3,Minor group,C0,C,C0,C07,NA
C071,Information Systems Analysts and Consultants,4,Unit group,C07,C,C0,C07,C071
C072,Database Analysts and Data Administrators,4,Unit group,C07,C,C0,C07,C072
C073,Software Engineers and Designers,4,Unit group,C07,C,C0,C07,C073
C074,Computer Programmers and Interactive Media Developers,4,Unit group,C07,C,C0,C07,C074
C075,Web Designers and Developers,4,Unit group,C07,C,C0,C07,C075
C1,Technical Occupations Related to Natural and Applied Sciences,2,Major group,C,C,C1,NA,NA
C11,Technical Occupations in Physical Sciences,3,Minor group,C1,C,C1,C11,NA
C111,Chemical Technologists and Technicians,4,Unit group,C11,C,C1,C11,C111
C112,Geological and Mineral Technologists and Technicians,4,Unit group,C11,C,C1,C11,C112
C113,Meteorological Technicians,4,Unit group,C11,C,C1,C11,C113
C12,Technical Occupations in Life Sciences,3,Minor group,C1,C,C1,C12,NA
C121,Biological Technologists and Technicians,4,Unit group,C12,C,C1,C12,C121
C122,Agricultural and Fish Products Inspectors,4,Unit group,C12,C,C1,C12,C122
C123,Forestry Technologists and Technicians,4,Unit group,C12,C,C1,C12,C123
C124,Conservation and Fishery Officers,4,Unit group,C12,C,C1,C12,C124
C125,Landscape and Horticulture Technicians and Specialists,4,Unit group,C12,C,C1,C12,C125
C13,"Technical Occupations in Civil, Mechanical and Industrial Engineering",3,Minor group,C1,C,C1,C13,NA
C131,Civil Engineering Technologists and Technicians,4,Unit group,C13,C,C1,C13,C131
C132,Mechanical Engineering Technologists and Technicians,4,Unit group,C13,C,C1,C13,C132
C133,Industrial Engineering and Manufacturing Technologists and Technicians,4,Unit group,C13,C,C1,C13,C133
C134,Construction Estimators,4,Unit group,C13,C,C1,C13,C134
C14,Technical Occupations in Electronics and Electrical Engineering,3,Minor group,C1,C,C1,C14,NA
C141,Electrical and Electronics Engineering Technologists and Technicians,4,Unit group,C14,C,C1,C14,C141
C142,Electronic Service Technicians (Household and Business Equipment),4,Unit group,C14,C,C1,C14,C142
C143,Industrial Instrument Technicians and Mechanics,4,Unit group,C14,C,C1,C14,C143
C144,"Aircraft Instrument, Electrical and Avionics Mechanics, Technicians and Inspectors",4,Unit group,C14,C,C1,C14,C144
C15,"Technical Occupations in Architecture, Drafting, Surveying and Mapping",3,Minor group,C1,C,C1,C15,NA
C151,Architectural Technologists and Technicians,4,Unit group,C15,C,C1,C15,C151
C152,Industrial Designers,4,Unit group,C15,C,C1,C15,C152
C153,Drafting Technologists and Technicians,4,Unit group,C15,C,C1,C15,C153
C154,Land Survey Technologists and Technicians,4,Unit group,C15,C,C1,C15,C154
C155,Mapping and Related Technologists and Technicians,4,Unit group,C15,C,C1,C15,C155
C16,Other Technical Inspectors and Regulatory Officers,3,Minor group,C1,C,C1,C16,NA
C161,Non-destructive Testers and Inspectors,4,Unit group,C16,C,C1,C16,C161
C162,Engineering Inspectors and Regulatory Officers,4,Unit group,C16,C,C1,C16,C162
C163,Inspectors in Public and Environmental Health and Occupational Health and Safety,4,Unit group,C16,C,C1,C16,C163
C164,Construction Inspectors,4,Unit group,C16,C,C1,C16,C164
C17,Transportation Officers and Controllers,3,Minor group,C1,C,C1,C17,NA
C171,"Air Pilots, Flight Engineers and Flying Instructors",4,Unit group,C17,C,C1,C17,C171
C172,Air Traffic Control and Related Occupations,4,Unit group,C17,C,C1,C17,C172
C173,"Deck Officers, Water Transport",4,Unit group,C17,C,C1,C17,C173
C174,"Engineer Officers, Water Transport",4,Unit group,C17,C,C1,C17,C174
C175,Railway Traffic Controllers and Marine Traffic Regulators,4,Unit group,C17,C,C1,C17,C175
C18,Technical Occupations in Computer and Information Systems,3,Minor group,C1,C,C1,C18,NA
C181,Computer Network Technicians,4,Unit group,C18,C,C1,C18,C181
C182,User Support Technicians,4,Unit group,C18,C,C1,C18,C182
C183,Systems Testing Technicians,4,Unit group,C18,C,C1,C18,C183
D,Health Occupations,1,Broad occupational category,NA,D,NA,NA,NA
D0,Professional Occupations in Health,2,Major group,D,D,D0,NA,NA
D01,"Physicians, Dentists and Veterinarians",3,Minor group,D0,D,D0,D01,NA
D011,Specialist Physicians,4,Unit group,D01,D,D0,D01,D011
D012,General Practitioners and Family Physicians,4,Unit group,D01,D,D0,D01,D012
D013,Dentists,4,Unit group,D01,D,D0,D01,D013
D014,Veterinarians,4,Unit group,D01,D,D0,D01,D014
D02,"Optometrists, Chiropractors and Other Health Diagnosing and Treating Professionals",3,Minor group,D0,D,D0,D02,NA
D021,Optometrists,4,Unit group,D02,D,D0,D02,D021
D022,Chiropractors,4,Unit group,D02,D,D0,D02,D022
D023,Other Professional Occupations in Health Diagnosing and Treating,4,Unit group,D02,D,D0,D02,D023
D03,"Pharmacists, Dietitians and Nutritionists",3,Minor group,D0,D,D0,D03,NA
D031,Pharmacists,4,Unit group,D03,D,D0,D03,D031
D032,Dietitians and Nutritionists,4,Unit group,D03,D,D0,D03,D032
D04,Therapy and Assessment Professionals,3,Minor group,D0,D,D0,D04,NA
D041,Audiologists and Speech-Language Pathologists,4,Unit group,D04,D,D0,D04,D041
D042,Physiotherapists,4,Unit group,D04,D,D0,D04,D042
D043,Occupational Therapists,4,Unit group,D04,D,D0,D04,D043
D044,Other Professional Occupations in Therapy and Assessment,4,Unit group,D04,D,D0,D04,D044
D1,Nurse Supervisors and Registered Nurses,2,Major group,D,D,D1,NA,NA
D11,Nurse Supervisors and Registered Nurses,3,Minor group,D1,D,D1,D11,NA
D111,Head Nurses and Supervisors,4,Unit group,D11,D,D1,D11,D111
D112,Registered Nurses,4,Unit group,D11,D,D1,D11,D112
D2,Technical and Related Occupations in Health,2,Major group,D,D,D2,NA,NA
D21,Medical Technologists and Technicians (Except Dental Health),3,Minor group,D2,D,D2,D21,NA
D211,Medical Laboratory Technologists and Pathologists' Assistants,4,Unit group,D21,D,D2,D21,D211
D212,Medical Laboratory Technicians,4,Unit group,D21,D,D2,D21,D212
D213,Veterinary and Animal Health Technologists and Technicians,4,Unit group,D21,D,D2,D21,D213
D214,"Respiratory Therapists, Clinical Perfusionists and Cardiopulmonary Technologists",4,Unit group,D21,D,D2,D21,D214
D215,Medical Radiation Technologists,4,Unit group,D21,D,D2,D21,D215
D216,Medical Sonographers,4,Unit group,D21,D,D2,D21,D216
D217,Cardiology Technologists,4,Unit group,D21,D,D2,D21,D217
D218,"Electroencephalographic and Other Diagnostic Technologists, n.e.c.",4,Unit group,D21,D,D2,D21,D218
D219,Other Medical Technologists and Technicians (Except Dental Health),4,Unit group,D21,D,D2,D21,D219
D22,Technical Occupations in Dental Health Care,3,Minor group,D2,D,D2,D22,NA
D221,Denturists,4,Unit group,D22,D,D2,D22,D221
D222,Dental Hygienists and Dental Therapists,4,Unit group,D22,D,D2,D22,D222
D223,"Dental Technologists, Technicians and Laboratory Bench Workers",4,Unit group,D22,D,D2,D22,D223
D23,Other Technical Occupations in Health Care (Except Dental),3,Minor group,D2,D,D2,D23,NA
D231,Opticians,4,Unit group,D23,D,D2,D23,D231
D232,Midwives and Practitioners of Natural Healing,4,Unit group,D23,D,D2,D23,D232
D233,Licensed Practical Nurses,4,Unit group,D23,D,D2,D23,D233
D234,Ambulance Attendants and Other Paramedical Occupations,4,Unit group,D23,D,D2,D23,D234
D235,Other Technical Occupations in Therapy and Assessment,4,Unit group,D23,D,D2,D23,D235
D3,Assisting Occupations in Support of Health Services,2,Major group,D,D,D3,NA,NA
D31,Assisting Occupations in Support of Health Services,3,Minor group,D3,D,D3,D31,NA
D311,Dental Assistants,4,Unit group,D31,D,D3,D31,D311
D312,"Nurse Aides, Orderlies and Patient Service Associates",4,Unit group,D31,D,D3,D31,D312
D313,Other Assisting Occupations in Support of Health Services,4,Unit group,D31,D,D3,D31,D313
E,"Occupations in Social Science, Education, Government Service and Religion",1,Broad occupational category,NA,E,NA,NA,NA
E0,"Judges, Lawyers, Psychologists, Social Workers, Ministers of Religion, and Policy and Program Officers",2,Major group,E,E,E0,NA,NA
E01,"Judges, Lawyers and Quebec Notaries",3,Minor group,E0,E,E0,E01,NA
E011,Judges,4,Unit group,E01,E,E0,E01,E011
E012,Lawyers and Quebec Notaries,4,Unit group,E01,E,E0,E01,E012
E02,"Psychologists, Social Workers, Counsellors, Clergy and Probation Officers",3,Minor group,E0,E,E0,E02,NA
E021,Psychologists,4,Unit group,E02,E,E0,E02,E021
E022,Social Workers,4,Unit group,E02,E,E0,E02,E022
E023,"Family, Marriage and Other Related Counsellors",4,Unit group,E02,E,E0,E02,E023
E024,Ministers of Religion,4,Unit group,E02,E,E0,E02,E024
E025,Probation and Parole Officers and Related Occupations,4,Unit group,E02,E,E0,E02,E025
E03,"Policy and Program Officers, Researchers and Consultants",3,Minor group,E0,E,E0,E03,NA
E031,"Natural and Applied Science Policy Researchers, Consultants and Program Officers",4,Unit group,E03,E,E0,E03,E031
E032,Economists and Economic Policy Researchers and Analysts,4,Unit group,E03,E,E0,E03,E032
E033,Business Development Officers and Marketing Researchers and Consultants,4,Unit group,E03,E,E0,E03,E033
E034,"Social Policy Researchers, Consultants and Program Officers",4,Unit group,E03,E,E0,E03,E034
E035,"Education Policy Researchers, Consultants and Program Officers",4,Unit group,E03,E,E0,E03,E035
E036,"Recreation, Sports and Fitness Program Supervisors and Consultants",4,Unit group,E03,E,E0,E03,E036
E037,Program Officers Unique to Government,4,Unit group,E03,E,E0,E03,E037
E038,"Other Professional Occupations in Social Science, n.e.c.",4,Unit group,E03,E,E0,E03,E038
E039,"Health Policy Researchers, Consultants and Program Officers",4,Unit group,E03,E,E0,E03,E039
E1,Teachers and Professors,2,Major group,E,E,E1,NA,NA
E11,University Professors and Assistants,3,Minor group,E1,E,E1,E11,NA
E111,University Professors,4,Unit group,E11,E,E1,E11,E111
E112,Post-Secondary Teaching and Research Assistants,4,Unit group,E11,E,E1,E11,E112
E12,College and Other Vocational Instructors,3,Minor group,E1,E,E1,E12,NA
E121,College and Other Vocational Instructors,4,Unit group,E12,E,E1,E12,E121
E13,Secondary and Elementary School Teachers and Educational Counsellors,3,Minor group,E1,E,E1,E13,NA
E131,Secondary School Teachers,4,Unit group,E13,E,E1,E13,E131
E132,Elementary School and Kindergarten Teachers,4,Unit group,E13,E,E1,E13,E132
E133,Educational Counsellors,4,Unit group,E13,E,E1,E13,E133
E2,"Paralegals, Social Services Workers and Occupations in Education and Religion, n.e.c.",2,Major group,E,E,E2,NA,NA
E21,"Paralegals, Social Services Workers and Occupations in Education and Religion, n.e.c.",3,Minor group,E2,E,E2,E21,NA
E211,Paralegal and Related Occupations,4,Unit group,E21,E,E2,E21,E211
E212,Community and Social Service Workers,4,Unit group,E21,E,E2,E21,E212
E213,Employment Counsellors,4,Unit group,E21,E,E2,E21,E213
E214,Instructors and Teachers of Persons with Disabilities,4,Unit group,E21,E,E2,E21,E214
E215,Other Instructors,4,Unit group,E21,E,E2,E21,E215
E216,Other Religious Occupations,4,Unit group,E21,E,E2,E21,E216
E217,Early Childhood Educators and Assistants,4,Unit group,E21,E,E2,E21,E217
F,"Occupations in Art, Culture, Recreation and Sport",1,Broad occupational category,NA,F,NA,NA,NA
F0,Professional Occupations in Art and Culture,2,Major group,F,F,F0,NA,NA
F01,"Librarians, Archivists, Conservators and Curators",3,Minor group,F0,F,F0,F01,NA
F011,Librarians,4,Unit group,F01,F,F0,F01,F011
F012,Conservators and Curators,4,Unit group,F01,F,F0,F01,F012
F013,Archivists,4,Unit group,F01,F,F0,F01,F013
F02,"Writing, Translating and Public Relations Professionals",3,Minor group,F0,F,F0,F02,NA
F021,Authors and Writers,4,Unit group,F02,F,F0,F02,F021
F022,Editors,4,Unit group,F02,F,F0,F02,F022
F023,Journalists,4,Unit group,F02,F,F0,F02,F023
F024,Professional Occupations in Public Relations and Communications,4,Unit group,F02,F,F0,F02,F024
F025,"Translators, Terminologists and Interpreters",4,Unit group,F02,F,F0,F02,F025
F03,Creative and Performing Artists,3,Minor group,F0,F,F0,F03,NA
F031,"Producers, Directors, Choreographers and Related Occupations",4,Unit group,F03,F,F0,F03,F031
F032,"Conductors, Composers and Arrangers",4,Unit group,F03,F,F0,F03,F032
F033,Musicians and Singers,4,Unit group,F03,F,F0,F03,F033
F034,Dancers,4,Unit group,F03,F,F0,F03,F034
F035,Actors and Comedians,4,Unit group,F03,F,F0,F03,F035
F036,"Painters, Sculptors and Other Visual Artists",4,Unit group,F03,F,F0,F03,F036
F1,"Technical Occupations in Art, Culture, Recreation and Sport",2,Major group,F,F,F1,NA,NA
F11,"Technical Occupations in Libraries, Archives, Museums and Art Galleries",3,Minor group,F1,F,F1,F11,NA
F111,Library and Archive Technicians and Assistants,4,Unit group,F11,F,F1,F11,F111
F112,Technical Occupations Related to Museums and Art Galleries,4,Unit group,F11,F,F1,F11,F112
F12,"Photographers, Graphic Arts Technicians and Technical and Co-ordinating Occupations in Motion Pictures, Broadcasting and the Performing Arts",3,Minor group,F1,F,F1,F12,NA
F121,Photographers,4,Unit group,F12,F,F1,F12,F121
F122,Film and Video Camera Operators,4,Unit group,F12,F,F1,F12,F122
F123,Graphic Arts Technicians,4,Unit group,F12,F,F1,F12,F123
F124,Broadcast Technicians,4,Unit group,F12,F,F1,F12,F124
F125,Audio and Video Recording Technicians,4,Unit group,F12,F,F1,F12,F125
