nocs2006,nocs2006_title,noc2011,noc2011_title
G81,Childcare and home support workers,441,Home care providers and educational support occupations
G811,"Visiting homemakers, housekeepers and related occupations",4411,Home child care providers
G811,"Visiting homemakers, housekeepers and related occupations",4412,"Home support workers, housekeepers and related occupations"
G812,Elementary and secondary school teacher assistants,4413,Elementary and secondary school teacher assistants
G814,"Babysitters, nannies and parents' helpers",4411,Home child care providers
G9,Sales and service occupations n.e.c.,63,Service supervisors and specialized service occupations
G9,Sales and service occupations n.e.c.,65,Service representatives and other customer and personal services occupations
G9,Sales and service occupations n.e.c.,66,Sales support occupations
G9,Sales and service occupations n.e.c.,67,"Service support and other service occupations, n.e.c."
G91,Technical occupations in personal service,634,Specialized occupations in personal and customer services
G911,Hairstylists and barbers,6341,Hairstylists and barbers
G912,Funeral directors and embalmers,6346,Funeral directors and embalmers
G92,Other occupations in personal service,656,Other occupations in personal service
G921,"Image, social and other personal consultants",6561,"Image, social and other personal consultants"
G922,"Estheticians, electrologists and related occupations",6562,"Estheticians, electrologists and related occupations"
G923,Pet groomers and animal care workers,6563,Pet groomers and animal care workers
G924,Other personal service occupations,6564,Other personal service occupations
G93,Cleaners,673,Cleaners
G931,Light duty cleaners,6731,Light duty cleaners
G932,Specialized cleaners,6732,Specialized cleaners
G933,"Janitors, caretakers and building superintendents",6733,"Janitors, caretakers and building superintendents"
G94,Butchers and bakers,633,Butchers and bakers
G941,"Butchers, meat cutters and fishmongers - retail and wholesale",6331,"Butchers, meat cutters and fishmongers - retail and wholesale"
G942,Bakers,6332,Bakers
G96,"Food counter attendants, kitchen helpers and related occupations",671,"Food counter attendants, kitchen helpers and related support occupations"
G961,"Food counter attendants, kitchen helpers and related occupations",6711,"Food counter attendants, kitchen helpers and related support occupations"
G97,Other sales and related occupations,662,Other sales support and related occupations
G97,Other sales and related occupations,671,"Food counter attendants, kitchen helpers and related support occupations"
G971,Service station attendants,6621,Service station attendants
G972,Grocery clerks and store shelf stockers,6622,"Store shelf stockers, clerks and order fillers"
G973,Other elemental sales occupations,6623,Other sales related occupations
G973,Other elemental sales occupations,6711,"Food counter attendants, kitchen helpers and related support occupations"
G98,Other elemental service occupations,674,"Other service support and related occupations, n.e.c."
G981,Dry cleaning and laundry occupations,6741,"Dry cleaning, laundry and related occupations"
G982,"Ironing, pressing and finishing occupations",6741,"Dry cleaning, laundry and related occupations"
G983,Other elemental service occupations,6742,"Other service support occupations, n.e.c."
H,"Trades, transport and equipment operators and related occupations",6,Sales and service occupations
H,"Trades, transport and equipment operators and related occupations",7,"Trades, transport and equipment operators and related occupations"
H,"Trades, transport and equipment operators and related occupations",9,Occupations in manufacturing and utilities
H0,Contractors and supervisors in trades and transportation,72,"Industrial, electrical and construction trades"
H0,Contractors and supervisors in trades and transportation,73,Maintenance and equipment operation trades
H01,"Contractors and supervisors, trades and related workers",720,"Contractors and supervisors, industrial, electrical and construction trades and related workers"
H01,"Contractors and supervisors, trades and related workers",730,"Contractors and supervisors, maintenance trades and heavy equipment and transport operators"
H011,"Supervisors, machinists and related occupations",7201,"Contractors and supervisors, machining, metal forming, shaping and erecting trades and related occupations"
H012,"Contractors and supervisors, electrical trades and telecommunications occupations",7202,"Contractors and supervisors, electrical trades and telecommunications occupations"
H013,"Contractors and supervisors, pipefitting trades",7203,"Contractors and supervisors, pipefitting trades"
H014,"Contractors and supervisors, metal forming, shaping and erecting trades",7201,"Contractors and supervisors, machining, metal forming, shaping and erecting trades and related occupations"
H015,"Contractors and supervisors, carpentry trades",7204,"Contractors and supervisors, carpentry trades"
H016,"Contractors and supervisors, mechanic trades",7301,"Contractors and supervisors, mechanic trades"
H017,"Contractors and supervisors, heavy construction equipment crews",7302,"Contractors and supervisors, heavy equipment operator crews"
H018,"Supervisors, printing and related occupations",7303,"Supervisors, printing and related occupations"
H019,"Contractors and supervisors, other construction trades, installers, repairers and servicers",7205,"Contractors and supervisors, other construction trades, installers, repairers and servicers"
H02,"Supervisors, railway and motor transportation occupations",730,"Contractors and supervisors, maintenance trades and heavy equipment and transport operators"
H021,"Supervisors, railway transport operations",7304,"Supervisors, railway transport operations"
H022,"Supervisors, motor transport and other ground transit operators",7305,"Supervisors, motor transport and other ground transit operators"
H1,Construction trades,72,"Industrial, electrical and construction trades"
H11,"Plumbers, pipefitters and gas fitters",725,"Plumbers, pipefitters and gas fitters"
H111,Plumbers,7251,Plumbers
H112,"Steamfitters, pipefitters and sprinkler system installers",7252,"Steamfitters, pipefitters and sprinkler system installers"
H113,Gas fitters,7253,Gas fitters
H12,Carpenters and cabinetmakers,727,Carpenters and cabinetmakers
H121,Carpenters,7271,Carpenters
H122,Cabinetmakers,7272,Cabinetmakers
H13,Masonry and plastering trades,728,Masonry and plastering trades
H131,Bricklayers,7281,Bricklayers
H132,Concrete finishers,7282,Concrete finishers
H133,Tilesetters,7283,Tilesetters
H134,"Plasterers, drywall installers and finishers and lathers",7284,"Plasterers, drywall installers and finishers and lathers"
H14,Other construction trades,729,Other construction trades
H141,Roofers and shinglers,7291,Roofers and shinglers
H142,Glaziers,7292,Glaziers
H143,Insulators,7293,Insulators
H144,Painters and decorators,7294,Painters and decorators (except interior decorators)
H145,Floor covering installers,7295,Floor covering installers
H2,"Stationary engineers, power station operators and electrical trades and telecommunications occupations",72,"Industrial, electrical and construction trades"
H2,"Stationary engineers, power station operators and electrical trades and telecommunications occupations",92,"Processing, manufacturing and utilities supervisors and central control operators"
H21,Electrical trades and telecommunication occupations,724,Electrical trades and electrical power line and telecommunications workers
H211,Electricians (except industrial and power system),7241,Electricians (except industrial and power system)
H212,Industrial electricians,7242,Industrial electricians
H213,Power system electricians,7243,Power system electricians
H214,Electrical power line and cable workers,7244,Electrical power line and cable workers
H215,Telecommunications line and cable workers,7245,Telecommunications line and cable workers
H216,Telecommunications installation and repair workers,7246,Telecommunications installation and repair workers
H217,Cable television service and maintenance technicians,7247,Cable television service and maintenance technicians
H22,Stationary engineers and power station and system operators,924,Utilities equipment operators and controllers
H221,Stationary engineers and auxiliary equipment operators,9241,Power engineers and power systems operators
H222,Power systems and power station operators,9241,Power engineers and power systems operators
H3,"Machinists, metal forming, shaping and erecting occupations",72,"Industrial, electrical and construction trades"
H3,"Machinists, metal forming, shaping and erecting occupations",73,Maintenance and equipment operation trades
H31,Machinists and related occupations,723,"Machining, metal forming, shaping and erecting trades"
H311,Machinists and machining and tooling inspectors,7231,Machinists and machining and tooling inspectors
H312,Tool and die makers,7232,Tool and die makers
H32,"Metal forming, shaping and erecting trades",723,"Machining, metal forming, shaping and erecting trades"
H32,"Metal forming, shaping and erecting trades",738,"Printing press operators and other trades and related occupations, n.e.c."
H321,Sheet metal workers,7233,Sheet metal workers
H322,Boilermakers,7234,Boilermakers
H323,Structural metal and platework fabricators and fitters,7235,Structural metal and platework fabricators and fitters
H324,Ironworkers,7236,Ironworkers
H325,Blacksmiths and die setters,7384,"Other trades and related occupations, n.e.c."
H326,Welders and related machine operators,7237,Welders and related machine operators
H4,Mechanics,73,Maintenance and equipment operation trades
H41,Machinery and transportation equipment mechanics (except motor vehicle),731,Machinery and transportation equipment mechanics (except motor vehicle)
H411,Construction millwrights and industrial mechanics (except textile),7311,Construction millwrights and industrial mechanics
H412,Heavy-duty equipment mechanics,7312,Heavy-duty equipment mechanics
H413,Refrigeration and air conditioning mechanics,7313,Refrigeration and air conditioning mechanics
H414,Railway carmen/women,7314,Railway carmen/women
H415,Aircraft mechanics and aircraft inspectors,7315,Aircraft mechanics and aircraft inspectors
H416,Machine fitters,7316,Machine fitters
H417,Textile machinery mechanics and repairers,7311,Construction millwrights and industrial mechanics
H418,Elevator constructors and mechanics,7318,Elevator constructors and mechanics
H42,Automotive service technicians,732,Automotive service technicians
H421,"Automotive service technicians, truck and bus mechanics and mechanical repairers",7321,"Automotive service technicians, truck and bus mechanics and mechanical repairers"
H422,Motor vehicle body repairers,7322,Motor vehicle body repairers
H43,Other mechanics,733,Other mechanics and related repairers
H431,Oil and solid fuel heating mechanics,7331,Oil and solid fuel heating mechanics
H432,Electric appliance servicers and repairers,7332,Appliance servicers and repairers
H433,Electrical mechanics,7333,Electrical mechanics
H434,Motorcycle and other related mechanics,7334,"Motorcycle, all-terrain vehicle and other related mechanics"
H435,Other small engine and equipment mechanics,7334,"Motorcycle, all-terrain vehicle and other related mechanics"
H435,Other small engine and equipment mechanics,7335,Other small engine and small equipment repairers
H5,Other trades n.e.c.,63,Service supervisors and specialized service occupations
H5,Other trades n.e.c.,73,Maintenance and equipment operation trades
H5,Other trades n.e.c.,74,"Other installers, repairers and servicers and material handlers"
H5,Other trades n.e.c.,75,Transport and heavy equipment operation and related maintenance occupations
H51,"Upholsterers, tailors, shoe repairers, jewellers and related occupations",634,Specialized occupations in personal and customer services
H511,Upholsterers,6345,Upholsterers
H512,"Tailors, dressmakers, furriers and milliners",6342,"Tailors, dressmakers, furriers and milliners"
H513,Shoe repairers and shoemakers,6343,Shoe repairers and shoemakers
H514,"Jewellers, watch repairers and related occupations",6344,"Jewellers, jewellery and watch repairers and related occupations"
H52,"Printing press operators, commercial divers and other trades and related occupations, n.e.c.",738,"Printing press operators and other trades and related occupations, n.e.c."
H521,Printing press operators,7381,Printing press operators
H522,Commercial divers,7384,"Other trades and related occupations, n.e.c."
H523,Other trades and related occupations,7384,"Other trades and related occupations, n.e.c."
H53,"Other installers, repairers and servicers",744,"Other installers, repairers and servicers"
H53,"Other installers, repairers and servicers",753,Other transport equipment operators and related maintenance workers
H531,Residential and commercial installers and servicers,7441,Residential and commercial installers and servicers
H532,Waterworks and gas maintenance workers,7442,Waterworks and gas maintenance workers
H533,Automotive mechanical installers and servicers,7535,Other automotive mechanical installers and servicers
H534,Pest controllers and fumigators,7444,Pest controllers and fumigators
H535,Other repairers and servicers,7445,Other repairers and servicers
H6,Heavy equipment and crane operators including drillers,73,Maintenance and equipment operation trades
H6,Heavy equipment and crane operators including drillers,75,Transport and heavy equipment operation and related maintenance occupations
H61,Heavy equipment operators,752,Heavy equipment operators
H611,Heavy equipment operators (except crane),7521,Heavy equipment operators (except crane)
H612,Public works maintenance equipment operators,7522,Public works maintenance equipment operators and related workers
H62,"Crane operators, drillers and blasters",737,"Crane operators, drillers and blasters"
H621,Crane operators,7371,Crane operators
H622,"Drillers and blasters - surface mining, quarrying and construction",7372,"Drillers and blasters - surface mining, quarrying and construction"
H623,Water well drillers,7373,Water well drillers
H7,"Transportation equipment operators and related workers, excluding labourers",73,Maintenance and equipment operation trades
H7,"Transportation equipment operators and related workers, excluding labourers",75,Transport and heavy equipment operation and related maintenance occupations
H71,Motor vehicle and transit drivers,751,Motor vehicle and transit drivers
H711,Truck drivers,7511,Transport truck drivers
H712,"Bus drivers, subway operators and other transit operators",7512,"Bus drivers, subway operators and other transit operators"
H713,Taxi and limousine drivers and chauffeurs,7513,Taxi and limousine drivers and chauffeurs
H714,Delivery and courier service drivers,7514,Delivery and courier service drivers
H72,Train crew operating occupations,736,Train crew operating occupations
H721,Railway and yard locomotive engineers,7361,Railway and yard locomotive engineers
H722,Railway conductors and brakemen/women,7362,Railway conductors and brakemen/women
H73,Other transport equipment operators and related workers,753,Other transport equipment operators and related maintenance workers
H731,Railway yard workers,7531,Railway yard and track maintenance workers
H732,Railway track maintenance workers,7531,Railway yard and track maintenance workers
H733,"Deck crew, water transport",7532,Water transport deck and engine room crew
H734,"Engine room crew, water transport",7532,Water transport deck and engine room crew
H735,Lock and cable ferry operators and related occupations,7533,Boat and cable ferry operators and related occupations
H736,Boat operators,7533,Boat and cable ferry operators and related occupations
H737,Air transport ramp attendants,7534,Air transport ramp attendants
H8,"Trades helpers, construction and transportation labourers and related occupations",67,"Service support and other service occupations, n.e.c."
H8,"Trades helpers, construction and transportation labourers and related occupations",74,"Other installers, repairers and servicers and material handlers"
H8,"Trades helpers, construction and transportation labourers and related occupations",75,Transport and heavy equipment operation and related maintenance occupations
H8,"Trades helpers, construction and transportation labourers and related occupations",76,"Trades helpers, construction labourers and related occupations"
H81,Longshore workers and material handlers,672,"Support occupations in accommodation, travel and amusement services"
H81,Longshore workers and material handlers,745,Longshore workers and material handlers
H811,Longshore workers,7451,Longshore workers
H812,Material handlers,6721,"Support occupations in accommodation, travel and facilities set-up services"
H812,Material handlers,7452,Material handlers
H82,Trades helpers and labourers,752,Heavy equipment operators
H82,Trades helpers and labourers,761,Trades helpers and labourers
H821,Construction trades helpers and labourers,7611,Construction trades helpers and labourers
H822,Other trades helpers and labourers,7522,Public works maintenance equipment operators and related workers
H822,Other trades helpers and labourers,7612,Other trades helpers and labourers
H83,"Public works and other labourers, n.e.c.",762,"Public works and other labourers, n.e.c."
H831,Public works and maintenance labourers,7621,Public works and maintenance labourers
H832,Railway and motor transport labourers,7622,Railway and motor transport labourers
I,Occupations unique to primary industry,0,Management occupations
I,Occupations unique to primary industry,8,"Natural resources, agriculture and related production occupations"
I0,Occupations unique to agriculture excluding labourers,07-09,"Middle management occupations in trades, transportation, production and utilities"
I0,Occupations unique to agriculture excluding labourers,82,"Supervisors and technical occupations in natural resources, agriculture and related production"
I0,Occupations unique to agriculture excluding labourers,84,"Workers in natural resources, agriculture and related production"
I01,"Contractors, operators and supervisors in agriculture, horticulture and aquaculture",082,"Managers in agriculture, horticulture and aquaculture"
I01,"Contractors, operators and supervisors in agriculture, horticulture and aquaculture",825,"Contractors and supervisors, agriculture, horticulture and related operations and services"
I011,Farmers and farm managers,0821,Managers in agriculture
I012,Agricultural and related service contractors and managers,8252,"Agricultural service contractors, farm supervisors and specialized livestock workers"
I013,Farm supervisors and specialized livestock workers,8252,"Agricultural service contractors, farm supervisors and specialized livestock workers"
I014,Nursery and greenhouse operators and managers,0822,Managers in horticulture
I015,Landscaping and grounds maintenance contractors and managers,8255,"Contractors and supervisors, landscaping, grounds maintenance and horticulture services"
I016,"Supervisors, landscape and horticulture",8255,"Contractors and supervisors, landscaping, grounds maintenance and horticulture services"
I017,Aquaculture operators and managers,0823,Managers in aquaculture
I02,Agriculture and horticulture workers,843,Agriculture and horticulture workers
I021,General farm workers,8431,General farm workers
I022,Nursery and greenhouse workers,8432,Nursery and greenhouse workers
I1,"Occupations unique to forestry operations, mining, oil and gas extraction and fishing, excluding labourers",82,"Supervisors and technical occupations in natural resources, agriculture and related production"
I1,"Occupations unique to forestry operations, mining, oil and gas extraction and fishing, excluding labourers",84,"Workers in natural resources, agriculture and related production"
I11,"Supervisors, logging and forestry",821,"Supervisors, logging and forestry"
I111,"Supervisors, logging and forestry",8211,"Supervisors, logging and forestry"
I12,"Supervisors, mining, oil and gas",822,"Contractors and supervisors, mining, oil and gas"
I121,"Supervisors, mining and quarrying",8221,"Supervisors, mining and quarrying"
I122,"Supervisors, oil and gas drilling and service",8222,"Contractors and supervisors, oil and gas drilling and services"
I13,"Underground miners, oil and gas drillers and related workers",823,"Underground miners, oil and gas drillers and related occupations"
I131,Underground production and development miners,8231,Underground production and development miners
I132,"Oil and gas well drillers, servicers, testers and related workers",8232,"Oil and gas well drillers, servicers, testers and related workers"
I14,Mine service workers and operators in oil and gas drilling,841,Mine service workers and operators in oil and gas drilling
I141,Underground mine service and support workers,8411,Underground mine service and support workers
I142,Oil and gas well drilling workers and services operators,8412,Oil and gas well drilling and related workers and services operators
I15,Logging machinery operators,824,Logging machinery operators
I151,Logging machinery operators,8241,Logging machinery operators
I16,Logging and forestry workers,842,Logging and forestry workers
I161,Chain saw and skidder operators,8421,Chain saw and skidder operators
I162,Silviculture and forestry workers,8422,Silviculture and forestry workers
I17,Fishing vessel masters and skippers and fishermen/women,826,Fishing vessel masters and fishermen/women
I171,Fishing masters and officers,8261,Fishing masters and officers
I172,Fishing vessel skippers and fishermen/women,8262,Fishermen/women
I18,Other fishing and trapping occupations,844,Other workers in fishing and trapping and hunting occupations
I181,Fishing vessel deckhands,8441,Fishing vessel deckhands
I182,Trappers and hunters,8442,Trappers and hunters
I2,Primary production labourers,86,"Harvesting, landscaping and natural resources labourers"
I21,Primary production labourers,861,"Harvesting, landscaping and natural resources labourers"
I211,Harvesting labourers,8611,Harvesting labourers
I212,Landscaping and grounds maintenance labourers,8612,Landscaping and grounds maintenance labourers
I213,Aquaculture and marine harvest labourers,8613,Aquaculture and marine harvest labourers
I214,Mine labourers,8614,Mine labourers
I215,"Oil and gas drilling, servicing and related labourers",8615,"Oil and gas drilling, servicing and related labourers"
I216,Logging and forestry labourers,8616,Logging and forestry labourers
J,"Occupations unique to processing, manufacturing and utilities",9,Occupations in manufacturing and utilities
J0,Supervisors in manufacturing,92,"Processing, manufacturing and utilities supervisors and central control operators"
J01,"Supervisors, processing occupations",921,"Supervisors, processing and manufacturing occupations"
J011,"Supervisors, mineral and metal processing",9211,"Supervisors, mineral and metal processing"
J012,"Supervisors, petroleum, gas and chemical processing and utilities",9212,"Supervisors, petroleum, gas and chemical processing and utilities"
J013,"Supervisors, food, beverage and tobacco processing",9213,"Supervisors, food, beverage and associated products processing"
J014,"Supervisors, plastic and rubber products manufacturing",9214,"Supervisors, plastic and rubber products manufacturing"
J015,"Supervisors, forest products processing",9215,"Supervisors, forest products processing"
J016,"Supervisors, textile processing",9217,"Supervisors, textile, fabric, fur and leather products processing and manufacturing"
J02,"Supervisors, assembly and fabrication",921,"Supervisors, processing and manufacturing occupations"
J02,"Supervisors, assembly and fabrication",922,"Supervisors, assembly and fabrication"
J021,"Supervisors, motor vehicle assembling",9221,"Supervisors, motor vehicle assembling"
J022,"Supervisors, electronics manufacturing",9222,"Supervisors, electronics manufacturing"
J023,"Supervisors, electrical products manufacturing",9223,"Supervisors, electrical products manufacturing"
J024,"Supervisors, furniture and fixtures manufacturing",9224,"Supervisors, furniture and fixtures manufacturing"
J025,"Supervisors, fabric, fur and leather products manufacturing",9217,"Supervisors, textile, fabric, fur and leather products processing and manufacturing"
J026,"Supervisors, other mechanical and metal products manufacturing",9226,"Supervisors, other mechanical and metal products manufacturing"
J027,"Supervisors, other products manufacturing and assembly",9227,"Supervisors, other products manufacturing and assembly"
J1,Machine operators in manufacturing,92,"Processing, manufacturing and utilities supervisors and central control operators"
J1,Machine operators in manufacturing,94,Processing and manufacturing machine operators and related production workers
J1,Machine operators in manufacturing,95,Assemblers in manufacturing
J11,Central control and process operators in manufacturing and processing,923,Central control and process operators in processing and manufacturing
J11,Central control and process operators in manufacturing and processing,943,Machine operators and related workers in pulp and paper production and wood processing and manufacturing
J111,"Central control and process operators, mineral and metal processing",9231,"Central control and process operators, mineral and metal processing"
J112,"Petroleum, gas and chemical process operators",9232,"Petroleum, gas and chemical process operators"
J113,Pulping control operators,9235,"Pulping, papermaking and coating control operators"
J113,Pulping control operators,9432,Pulp mill machine operators
J114,Papermaking and coating control operators,9235,"Pulping, papermaking and coating control operators"
