nocs2006,nocs2006_title,noc2011,noc2011_title
J114,Papermaking and coating control operators,9433,Papermaking and finishing machine operators
J12,Machine operators and related workers in metal and mineral products processing,941,Machine operators and related workers in mineral and metal products processing and manufacturing
J121,"Machine operators, mineral and metal processing",9411,"Machine operators, mineral and metal processing"
J122,Foundry workers,9412,Foundry workers
J123,Glass forming and finishing machine operators and glass cutters,9413,Glass forming and finishing machine operators and glass cutters
J124,"Concrete, clay and stone forming operators",9414,"Concrete, clay and stone forming operators"
J125,"Inspectors and testers, mineral and metal processing",9415,"Inspectors and testers, mineral and metal processing"
J13,"Machine operators and related workers in chemical, plastic and rubber processing",924,Utilities equipment operators and controllers
J13,"Machine operators and related workers in chemical, plastic and rubber processing",942,"Machine operators and related workers in chemical, plastic and rubber processing"
J131,Chemical plant machine operators,9421,Chemical plant machine operators
J132,Plastics processing machine operators,9422,Plastics processing machine operators
J133,Rubber processing machine operators and related workers,9423,Rubber processing machine operators and related workers
J134,Water and waste plant operators,9243,Water and waste treatment plant operators
J14,Machine operators and related workers in pulp and paper production and wood processing,943,Machine operators and related workers in pulp and paper production and wood processing and manufacturing
J141,Sawmill machine operators,9431,Sawmill machine operators
J142,Pulp mill machine operators,9432,Pulp mill machine operators
J143,Papermaking and finishing machine operators,9433,Papermaking and finishing machine operators
J144,Other wood processing machine operators,9434,Other wood processing machine operators
J145,Paper converting machine operators,9435,Paper converting machine operators
J146,Lumber graders and other wood processing inspectors and graders,9436,Lumber graders and other wood processing inspectors and graders
J15,Machine operators and related workers in textile processing,944,"Machine operators and related workers in textile, fabric, fur and leather products processing and manufacturing"
J151,Textile fibre and yarn preparation machine operators,9441,"Textile fibre and yarn, hide and pelt processing machine operators and workers"
J152,"Weavers, knitters and other fabric-making occupations",9442,"Weavers, knitters and other fabric making occupations"
J153,Textile dyeing and finishing machine operators,9441,"Textile fibre and yarn, hide and pelt processing machine operators and workers"
J154,"Textile inspectors, graders and samplers",9447,"Inspectors and graders, textile, fabric, fur and leather products manufacturing"
J16,"Machine operators and related workers in fabric, fur and leather products manufacturing",944,"Machine operators and related workers in textile, fabric, fur and leather products processing and manufacturing"
J161,Sewing machine operators,9446,Industrial sewing machine operators
J162,"Fabric, fur and leather cutters",9445,"Fabric, fur and leather cutters"
J163,Hide and pelt processing workers,9441,"Textile fibre and yarn, hide and pelt processing machine operators and workers"
J164,"Inspectors and testers, fabric, fur and leather products manufacturing",9447,"Inspectors and graders, textile, fabric, fur and leather products manufacturing"
J17,"Machine operators and related workers in food, beverage and tobacco processing",946,"Machine operators and related workers in food, beverage and associated products processing"
J171,"Process control and machine operators, food and beverage processing",9461,"Process control and machine operators, food, beverage and associated products processing"
J172,"Industrial butchers and meat cutters, poultry preparers and related workers",9462,"Industrial butchers and meat cutters, poultry preparers and related workers"
J173,Fish plant workers,9463,Fish and seafood plant workers
J174,Tobacco processing machine operators,9461,"Process control and machine operators, food, beverage and associated products processing"
J175,"Testers and graders, food and beverage processing",9465,"Testers and graders, food, beverage and associated products processing"
J18,Printing machine operators and related occupations,947,Printing equipment operators and related occupations
J181,Printing machine operators,9471,Plateless printing equipment operators
J182,"Camera, platemaking and other prepress occupations",9472,"Camera, platemaking and other prepress occupations"
J183,Binding and finishing machine operators,9473,Binding and finishing machine operators
J184,Photographic and film processors,9474,Photographic and film processors
J19,"Machining, metalworking, woodworking and related machine operators",941,Machine operators and related workers in mineral and metal products processing and manufacturing
J19,"Machining, metalworking, woodworking and related machine operators",943,Machine operators and related workers in pulp and paper production and wood processing and manufacturing
J19,"Machining, metalworking, woodworking and related machine operators",953,Other assembly and related occupations
J191,Machining tool operators,9417,Machining tool operators
J192,Forging machine operators,9416,Metalworking and forging machine operators
J193,Woodworking machine operators,9437,Woodworking machine operators
J194,Metalworking machine operators,9416,Metalworking and forging machine operators
J196,Other metal products machine operators,9418,Other metal products machine operators
J197,Other products machine operators,9537,"Other products assemblers, finishers and inspectors"
J2,Assemblers in manufacturing,95,Assemblers in manufacturing
J21,"Mechanical, electrical and electronics assemblers",952,"Mechanical, electrical and electronics assemblers"
J211,Aircraft assemblers and aircraft assembly inspectors,9521,Aircraft assemblers and aircraft assembly inspectors
J212,"Motor vehicle assemblers, inspectors and testers",9522,"Motor vehicle assemblers, inspectors and testers"
J213,"Electronics assemblers, fabricators, inspectors and testers",9523,"Electronics assemblers, fabricators, inspectors and testers"
J214,"Assemblers and inspectors, electrical appliance, apparatus and equipment manufacturing",9524,"Assemblers and inspectors, electrical appliance, apparatus and equipment manufacturing"
J215,"Assemblers, fabricators and inspectors, industrial electrical motors and transformers",9525,"Assemblers, fabricators and inspectors, industrial electrical motors and transformers"
J216,Mechanical assemblers and inspectors,9526,Mechanical assemblers and inspectors
J217,"Machine operators and inspectors, electrical apparatus manufacturing",9527,"Machine operators and inspectors, electrical apparatus manufacturing"
J22,Other assembly and related occupations,953,Other assembly and related occupations
J221,Boat assemblers and inspectors,9531,Boat assemblers and inspectors
J222,Furniture and fixture assemblers and inspectors,9532,Furniture and fixture assemblers and inspectors
J223,Other wood products assemblers and inspectors,9533,Other wood products assemblers and inspectors
J224,Furniture finishers and refinishers,9534,Furniture finishers and refinishers
J225,"Plastic products assemblers, finishers and inspectors",9535,"Plastic products assemblers, finishers and inspectors"
J226,Painters and coaters - industrial,9536,"Industrial painters, coaters and metal finishing process operators"
J227,"Plating, metal spraying and related operators",9536,"Industrial painters, coaters and metal finishing process operators"
J228,Other assemblers and inspectors,9537,"Other products assemblers, finishers and inspectors"
J3,"Labourers in processing, manufacturing and utilities",96,"Labourers in processing, manufacturing and utilities"
J31,"Labourers in processing, manufacturing and utilities",961,"Labourers in processing, manufacturing and utilities"
J311,Labourers in mineral and metal processing,9611,Labourers in mineral and metal processing
J312,Labourers in metal fabrication,9612,Labourers in metal fabrication
J313,Labourers in chemical products processing and utilities,9613,Labourers in chemical products processing and utilities
J314,"Labourers in wood, pulp and paper processing",9614,"Labourers in wood, pulp and paper processing"
J315,Labourers in rubber and plastic products manufacturing,9615,Labourers in rubber and plastic products manufacturing
J316,Labourers in textile processing,9616,Labourers in textile processing
J317,"Labourers in food, beverage and tobacco processing",9617,"Labourers in food, beverage and associated products processing"
J318,Labourers in fish processing,9618,Labourers in fish and seafood processing
J319,"Other labourers in processing, manufacturing and utilities",9619,"Other labourers in processing, manufacturing and utilities"
